{
  "schema_version": "core.skill_promotion_candidate.v1",
  "type": "skill_promotion_candidate",
  "source_execution_id": "synthetic.execution.docs_check.run_001",
  "skill_id": "synthetic.docs_check.v1",
  "promotion_reason": "repeatable read-only validation with stable output",
  "requires_human_approval": true,
  "activation_default": "disabled"
}
